,product_id,brand_name,product_title,mrp,price,product_rating,product_rating_count,product_tags
0,781070,Olay,Olay Ultra Lightweight Moisturiser: Luminous Whip Day Cream (non SPF),1999,1599,4.1,43,
1,739418,Olay,Olay Regenerist Whip Mini and Ultimate Eye Cream Combo,2198,1943,4.0,792,
2,6836720,Olay,"Olay Aha & Niacinamide Super Cream , Acne Mark & Spot Removal Cream - For All Skin Types",1999,1399,3.8,6,FEATURED
3,61305,Olay,Olay White Radiance Day & Night Cream for Brightening and Glow,2798,2378,4.0,55,
4,60541,Olay,Olay Total Effects 7 In One Anti-Ageing Day Cream Normal SPF 15,375,375,3.9,99,
5,575926,Olay,Olay Ultimate Skin Regimen Kit,2947,2947,4.1,920,
6,465454,Olay,Olay Eye Cream - With Niacinamide & Pentapeptides,1699,1444,4.0,771,
7,262993,Olay,Olay Total Effects Day Cream For Sensitive Skin - Niacinamide,899,764,4.1,575,
8,23694,Olay,Olay Total Effects 7 In One Day Cream Normal SPF 15 (Trial Size) 8gm,160,160,4.1,68,
9,785729,Nykaa Naturals,Nykaa Skin Secrets Tea Tree & Salicylic Acid Spot Patch,100,90,3.8,8212,BESTSELLER
10,784422,Nykaa Naturals,Nykaa Face and Eye Shield Mask,399,239,3.2,26,
11,784419,Nykaa Naturals,Nykaa Woman Washable and Reusable Face Mask - Tropical,299,299,3.6,664,
12,774771,Nykaa Naturals,Nykaa 3 Ply Mask With Face Shield,75,45,2.8,115,
13,5202105,Nykaa Naturals,Nykaa Naturals Apple Cider Vinegar & Ginger Anti-dandruff Hair Oil + Shampoo + Massager Combo,1497,1048,4.0,319,
14,4315900,Nykaa Naturals,Nykaa Love Struck Tender Touch Shower Gel + Body Lotion + Perfume,1597,1118,4.0,6,
15,4283093,Nykaa Naturals,Nykaa Naturals Mini Shampoo,99,99,3.7,256,
16,4148779,Nykaa Naturals,Nykaa Naturals Charcoal & Bamboo Shampoo And Hair Wrap Combo,898,723,4.0,14,
17,4060539,Nykaa Naturals,Nykaa Naturals Clay It Cool Daily Detox Clay Mask + Perfect Glow Clay Mask for Supple Skin,1198,899,3.8,5,
18,4060531,Nykaa Naturals,Nykaa Naturals Glow Boosting Skin Potion + Anti- Ageing Skin Potion Face Oil,1398,1049,4.0,1,
19,4039424,Nykaa Naturals,Nykaa Naturals Calming Face Wash + Tea Tree & Salicylic Acid Spot Patch + Witch Hazel & AHA Sleeping Mask,414,311,3.8,8218,
20,3955548,Nykaa Naturals,"Nykaa Naturals Apple Cider Vinegar & Ginger Anti-Dandruff Oil, Shampoo, Mask & Wrap Combo",2096,1362,4.0,449,
21,3955547,Nykaa Naturals,"Nykaa Naturals Apple Cider Vinegar & Ginger Anti-dandruff Oil, Shampoo, Conditioner & Wrap Combo",1896,1232,4.1,759,
22,3955546,Nykaa Naturals,"Nykaa Naturals Apple Cider Vinegar & Ginger Anti-dandruff Hair Oil, Shampoo And Hair Wrap Combo",1497,1048,4.0,319,
23,3955545,Nykaa Naturals,"Nykaa Naturals Apple Cider Vinegar & Ginger Anti-dandruff Hair Oil, Shampoo And Hair Mask Combo",1597,1118,4.0,449,
24,3955543,Nykaa Naturals,"Nykaa Naturals Apple Cider Vinegar & Ginger Hair Oil, Shampoo And Conditioner - Anti Dandruff Combo",1397,978,4.1,761,
25,3955542,Nykaa Naturals,Nykaa Naturals Apple Cider Vinegar & Ginger Anti-dandruff Hair Oil And Shampoo Combo,998,749,4.0,321,
26,3626216,Nykaa Naturals,Nykaa Love Struck Skip A Beat Body Lotion + Perfume,1198,779,3.9,10,
27,3494214,Nykaa Naturals,Nykaa Naturals 5 Shampoo Combo-Onion +Apple Cider Vinegar +Amla +Fermented Rice Water+Reetha,1995,1297,4.1,973,
28,3494211,Nykaa Naturals,Nykaa Naturals Reetha & Shikakai Shampoo For Dull & Brittle Hair - Pack Of 2,798,599,4.0,49,
29,3433811,Nykaa Naturals,Nykaa Vitamin C PM Regime with Skin Secret Rice Water & Vitamin C Sleeping Mask + Facial Ice Globes,3874,2905,3.9,76,
30,2809991,Nykaa Naturals,Nykaa Naturals De-tanning Face Wash + Face Scrub + Clay It Cool Daily Detox Clay Mask,987,691,4.0,2,
31,2809976,Nykaa Naturals,Nykaa Naturals Calming Face Wash + Face Scrub + Clay It Cool Oil Control Clay Mask,987,691,3.6,7,
32,2777822,Nykaa Naturals,Nykaa Naturals 4 Shampoo Combo-Onion+Apple Cider Vinegar+Amla & Curry Leaves+Fermented Rice Water,1596,1037,4.1,928,
33,2722174,Nykaa Naturals,Nykaa Naturals Anti-Pigmentation & De-tanning Face Wash Combo - Papaya +Sandalwood & Orange Peel,278,195,3.8,27,
34,2722169,Nykaa Naturals,Nykaa Naturals Calming & De-tanning Face Wash Combo,278,195,3.9,8,
35,2722163,Nykaa Naturals,Nykaa Naturals Anti-pigmentation & Radiant Skin Face Wash Combo,278,195,4.1,21,
36,2722162,Nykaa Naturals,Nykaa Naturals Anti-pigmentation & Purifying Skin Face Wash Combo,278,209,3.7,9,
37,2722155,Nykaa Naturals,Nykaa Naturals Calming Face Wash + Nykaa Tea Tree & Salicylic Acid Spot Patch,239,203,3.8,8221,
38,2722154,Nykaa Naturals,Nykaa Naturals Calming Face Wash + Nykaa Clay It Cool Oil Control Clay Mask,738,517,3.3,6,
39,2722149,Nykaa Naturals,Nykaa Naturals Radiance Face Wash + Nykaa Tea Tree & Salicylic Acid Spot Patch,239,203,3.8,8219,
40,2722148,Nykaa Naturals,Nykaa Naturals Radiance Face Wash + Nykaa Clay It Cool Perfect Glow Clay Mask,738,517,4.0,4,
41,2722147,Nykaa Naturals,Nykaa Naturals Radiance Face Wash + Rice Water & Vitamin C Sleeping Mask Combo,314,220,4.0,3,
42,2722144,Nykaa Naturals,Nykaa Naturals Anti-pigmentation Face Wash + Nykaa Tea Tree & Salicylic Acid Spot Patch,239,167,3.8,8221,
43,2722137,Nykaa Naturals,Nykaa Naturals Hydrating Face Wash + Nykaa Tea Tree & Salicylic Acid Spot Patch,239,203,3.8,8220,
44,2697394,Nykaa Naturals,Nykaa Naturals Charcoal & Bamboo Deep Detox And Cleanse Shampoo - Pack Of 2,798,599,4.0,14,
45,2645340,Nykaa Naturals,Nykaa Tea Tree & Salicylic Acid Spot Patch for Pimple Care - Pack Of 10,1000,850,3.8,8228,
46,2645339,Nykaa Naturals,Nykaa Tea Tree & Salicylic Acid Spot Patch for Pimple Care - Pack Of 5,500,425,3.8,8231,
47,2645338,Nykaa Naturals,Nykaa Anti Acne Combo (Spot Patch + Face Wash + Sleeping Mask),414,311,3.8,8223,
48,2645336,Nykaa Naturals,Nykaa Tea Tree & Salicylic Acid Spot Patch + Nykaa Rice Water & Vitamin C Sleeping Mask,275,206,3.8,8222,
49,2645335,Nykaa Naturals,Nykaa Tea Tree & Salicylic Acid Spot Patch + Nykaa Retinol & Hyaluronic Acid Sleeping Mask,275,206,3.8,8220,
50,2645334,Nykaa Naturals,Nykaa Tea Tree & Salicylic Acid Spot Patch + Nykaa Tea Tree & Aloe Vera Sleeping Mask,275,206,3.8,8219,
51,2645331,Nykaa Naturals,Nykaa Tea Tree & Salicylic Acid Spot Patch + Nykaa Saffron & Honey Face Wash,239,203,3.8,8224,
52,2645330,Nykaa Naturals,Nykaa Tea Tree & Salicylic Acid Spot Patch + Nykaa Sandalwood & Orange Peel Face Wash,239,179,3.8,8223,
53,2645329,Nykaa Naturals,Nykaa Tea Tree & Salicylic Acid Spot Patch + Nykaa Tea Tree & Neem Face Wash,239,179,3.8,8226,
54,2645328,Nykaa Naturals,Nykaa Tea Tree & Salicylic Acid Spot Patch for Pimple Care - Pack Of 2,200,170,3.8,8310,
55,1502905,Nykaa Naturals,"Nykaa Apple Cider Vinegar & Ginger Anti-Dandruff Shampoo,Conditioner,Hair Mask and Wrap Combo",1896,1232,4.1,811,
56,1502904,Nykaa Naturals,"Nykaa Naturals Apple Cider Vinegar & Ginger Shampoo, Conditioner & Hair Wrap - Anti Dandruff Combo",1297,908,4.1,689,
57,1502902,Nykaa Naturals,Nykaa Naturals Apple Cider Vinegar & Ginger Anti- Dandruff Shampoo and Hair Wrap Combo,898,674,3.8,251,
58,1498580,Nykaa Naturals,Nykaa Naturals Onion & Fenugreek + Apple Cider & Vinegar + Amla & Curry Leaves Shampoo - Pack of 3,1197,838,4.1,811,
59,1485846,Nykaa Naturals,Nykaa Naturals Jade Comb For Hair Growth And Scalp Health - Green Jade,2699,1889,3.7,7,
60,1485845,Nykaa Naturals,Nykaa Naturals Ice Roller for De-puffing and Face Toning Massage - Blue,1499,1124,3.7,125,
61,1485844,Nykaa Naturals,Nykaa Naturals Ice Roller for De-puffing and Face Toning Massage - Lavender,1499,1124,3.7,125,
62,1485843,Nykaa Naturals,Nykaa Naturals Ice Roller for De-puffing and Face Toning Massage - Pink,1499,1124,3.7,125,
63,1474701,Nykaa Naturals,Nykaa Naturals CleanTouch 2 in 1 Face Brush & Massager for Deep Cleansing & Exfoliation,2999,1799,3.9,240,FEATURED
64,1473197,Nykaa Naturals,Nykaa Naturals CleanTouch 2 in 1 Face Brush & Massager for Deep Cleansing & Exfoliation - Pink,2999,2249,3.9,240,
65,1366625,Nykaa Naturals,Nykaa Naturals Apple Cider Vinegar & Ginger Shampoo & Hair Mask,998,749,4.0,387,
66,1356977,Nykaa Naturals,Retinol & Hyaluronic Acid Sleeping Mask for Intense Hydration - Pack of 2,350,245,4.1,39,
67,1285508,Nykaa Naturals,Nykaa Naturals 2 in 1 Vibrating Face Roller With Under Eye Massager - Green Jade,3299,2309,3.7,43,
68,1217419,Nykaa Naturals,Nykaa Naturals Apple Cider Vinegar & Ginger Shampoo - Pack of 3,1197,838,3.9,257,
69,1171873,Nykaa Naturals,Nykaa Naturals Apple Cider Vinegar & Ginger Shampoo - Pack of 2,798,599,3.9,268,
70,1171833,Nykaa Naturals,Nykaa Naturals Apple Cider Vinegar & Ginger Shampoo & Conditioner- Anti-Dandruff Combo,798,599,4.1,870,
71,1058010,Nykaa Naturals,Nykaa Facial Ice Globes for Depuffing & Skin Tightening,3699,2774,3.9,74,
72,982132,Nykaa Cosmetics,Nykaa Mirror Shine Trousseau Box,1499,1199,3.3,334,
73,950973,Nykaa Cosmetics,Nykaa Matte to Last! Mini Metallic Liquid Lipstick and Eyeshadow,249,125,3.6,6053,
74,815797,Nykaa Cosmetics,"Nykaa Moi Fragrance Mini Bar Combo- Amour, Bisous, Joie De Vivre, Raison D'Etre",996,847,4.1,282,
75,792460,Nykaa Cosmetics,Nykaa Sun Gaze Holographic Vanity Kit 2,850,638,3.7,154,
76,787778,Nykaa Cosmetics,Nykaa Matte to Last! Mini Liquid Lipstick - Jhumki 14,239,203,3.9,80807,
77,68138,Nykaa Cosmetics,Nykaa Dual Tone Nail Enamel Remover,99,99,3.8,3377,
78,646041,Nykaa Cosmetics,Nykaa Mirror Shine Trousseau Box - Rose Gold,1999,1599,3.3,334,
79,626493,Nykaa Cosmetics,Nykaa Wing In A Blink Eyeliner Pen - Dark Knight 01,549,439,3.9,4124,
80,5880614,Nykaa Cosmetics,Nykaa Bestsellers - So Creme Lipstick - Wakeup Makeup + All Day Matte Liquid Lipstick - Soul Sister,648,551,3.8,8,
81,5880612,Nykaa Cosmetics,Nykaa Glamoreyes Coloured Liquid Eyeliner & Pencil Duo - Chaotic Calypso + Jade Jinx,749,637,3.9,232,
82,5694317,Nykaa Cosmetics,Nykaa Cosmetics Eyes On Me ! 4 In 1 Quad Eyeshadow Palette Desk To Date + Night Out,698,558,4.0,2,
83,569411,Nykaa Cosmetics,Nykaa Matte to Last! Metallic Liquid Lipstick and Eyeshadow,625,313,4.0,1890,
84,564441,Nykaa Cosmetics,Nykaa Lash Talk False Eyelash,199,149,3.9,11381,
85,564436,Nykaa Cosmetics,Nykaa Lash Talk False Eyelash - Major Length,199,149,3.9,11381,
86,551016,Nykaa Cosmetics,Nykaa Strobe & Glow Liquid Highlighter,699,559,4.1,8720,
87,551015,Nykaa Cosmetics,Nykaa Strobe & Glow Liquid Highlighter - Blushed Moonlight,699,699,4.1,8720,
88,551014,Nykaa Cosmetics,Nykaa Strobe & Glow Liquid Highlighter - Glazed Bronze,699,594,4.1,8720,
89,540693,Nykaa Cosmetics,Nykaa Get Set Matte! Demi Matte Lip Cream Liquid Lipstick - BASIC,450,450,3.8,11818,
90,520376,Nykaa Cosmetics,Nykaa Matte To Last! Mini Liquid Lipstick - Maithili 25,239,203,3.9,80807,
91,5177218,Nykaa Cosmetics,Nykaa Cosmetics Blendpro Powder Brushes Combo,1298,909,4.1,1359,
92,513866,Nykaa Cosmetics,Masaba By Nykaa - Face Palm Lipstick & Nail Enamel Combo,798,559,4.1,43,
93,513815,Nykaa Cosmetics,Masaba By Nykaa - You Croc My World Lipstick & Nail Enamel Combo,798,559,3.7,30,
94,513103,Nykaa Cosmetics,Masaba By Nykaa Lipstick,599,300,4.1,11653,
95,4996634,Nykaa Cosmetics,Nykaa Prep Me Up Primer + All Day Matte Foundation Perfect Your Base Combo,1198,1078,3.7,3,
96,4996628,Nykaa Cosmetics,Nykaa Cosmetics All Day Matte Long Wear Foundation + Compact - Beige,824,742,3.7,35,
97,4996626,Nykaa Cosmetics,Nykaa All Day Matte Long Wear Foundation + Compact - Ivory,824,742,3.2,5,
98,4749405,Nykaa Cosmetics,Nykaa Cosmetics Breathable Nail Enamel Set Of 4- Downtime Daisy + Lazy Lilac + Sea Breeze+Stay Zen,796,637,4.0,1,
99,4692430,Nykaa Cosmetics,Nykaa Cosmetics Mini Skinshield Anti-pollution Matte Foundation - Very Vanilla 02,169,169,4.1,101,
100,4641579,Nykaa Cosmetics,Nykaa Cosmetics Trending Neons Matte Nail Enamel - Cherry Pop + Lemonade Fizz + Pink Lemonade,597,448,4.1,308,
101,461917,Nykaa Cosmetics,Nykaa So Matte! Mini Lipstick - 37 M Beachy Peachy,199,159,4.0,98477,
102,461916,Nykaa Cosmetics,Nykaa So Matte! Mini Lipstick - 01 Notorious Red,199,159,4.0,98477,
103,461912,Nykaa Cosmetics,Nykaa So Matte! Mini Lipstick - 26 M Bon Bon,199,179,4.0,98477,
104,461910,Nykaa Cosmetics,Nykaa So Matte! Mini Lipstick - 45 M Dirty Peach,199,169,4.0,98477,
105,4613638,Nykaa Cosmetics,Nykaa Cosmetics Ultra Matte Lipsticks - Grace + Marilyn + Neferti,717,574,4.1,14,
106,4613636,Nykaa Cosmetics,Nykaa Cosmetics Puckers On With Matte To Last Liquid Lipstick- Begum + Boho + Maithili,717,502,2.9,38,
107,4613635,Nykaa Cosmetics,Nykaa Cosmetics Best Of Matte To Last In Minis- Janhvi + Madras Kaapi + Maharani,717,574,4.1,121,
108,4613633,Nykaa Cosmetics,Nykaa Cosmetics So Matte Mini Nude Lipsticks - Bon Bon + Totes Natural + Cinnamon Crunch,597,448,3.8,344,
109,448344,Nykaa Cosmetics,Nykaa Oh My Brow! Eyebrow Mascara - Sirius Brown,599,449,4.1,1442,
110,4432091,Nykaa Cosmetics,Nykaa Mini Skinshield Anti-pollution Matte Foundation,169,169,4.1,952,
111,437390,Nykaa Cosmetics,Nykaa BlendPro Highlighting Fan Makeup Brush,399,319,3.9,1368,
112,422911,Nykaa Cosmetics,Nykaa Serial Kisser Lip Balm - Grape,149,119,4.0,16264,
113,422909,Nykaa Cosmetics,Nykaa Serial Kisser Lip Balm - Pinacolada,149,127,4.0,16264,
114,422906,Nykaa Cosmetics,Nykaa Serial Kisser Lip Balm - Pomegranate,149,112,4.0,16281,
115,422905,Nykaa Cosmetics,Nykaa Serial Kisser Lip Balm - Raspberry,149,112,4.0,16264,
116,417929,Nykaa Cosmetics,Nykaa BlendPro Powder Stippling Makeup Brush,599,449,3.8,693,
117,394618,Nykaa Cosmetics,Nykaa Contour & Conquer - Contour and Highlight Duo - Sizzle Chisel 01,699,559,4.1,1246,
118,3840762,Nykaa Cosmetics,Nykaa Cosmetics Get Set Matte Liquid Lipstick Duo - G.O.A.T + LIT,900,450,4.1,42,
119,376843,Nykaa Cosmetics,Nykaa Wedding Lotus Gift Box,500,250,3.7,275,
120,376842,Nykaa Cosmetics,Nykaa Wedding Moringa Gift Box,500,250,3.7,76,
121,376841,Nykaa Cosmetics,Nykaa Wedding Jasmine Gift Box,500,250,3.8,68,
122,3756803,Nykaa Cosmetics,Nykaa Cosmetics Glam Eyes Look-Glamoreyes Coloured Liquid EyelinerChaotic Calypso+Enchanting Forest,598,478,3.9,320,
123,3756794,Nykaa Cosmetics,Masaba's Fiery Orange Look- Lipstick + Nail enamel- Can't Deal,798,399,3.5,11,
124,3756792,Nykaa Cosmetics,Nykaa Cosmetics Get Set Matte Look- All Day Matte compact powder- Maple + So Creme Matte Lipstick- Day Dreaming,524,393,4.1,7,
125,374238,Nykaa Cosmetics,Nykaa So Matte! Mini Lipstick - 03 Devious Pink,199,159,4.0,98477,
126,374235,Nykaa Cosmetics,Nykaa So Matte! Mini Lipstick - 17 M Cranberry Sangria,199,159,4.0,98477,
127,374233,Nykaa Cosmetics,Nykaa So Matte! Mini Lipstick - 30 M Regal Ruby,199,159,4.0,98477,
128,3705529,Nykaa Cosmetics,Moi Day & Night Fragrance Duo - Bisous + Matin,498,423,4.1,14,
129,3705524,Nykaa Cosmetics,Masaba Signature Kit - Lipstick + Nail Paint + Mini Perfume,1097,768,3.8,22,
130,3652978,Nykaa Cosmetics,Nykaa Cosmetics BlendPro Highlighting Fan Makeup Brush & Foundation Makeup Brush Combo,898,674,4.1,2305,
131,3597385,Nykaa Cosmetics,Nykaa Cosmetics Pastel Manicure Kit,1051,736,3.8,3669,
132,3597383,Nykaa Cosmetics,Nykaa Cosmetics Gel Shine Manicure- Nail Lacquer + Nail Care + Nail Enamel Remover,998,798,3.8,3501,
133,347365,Nykaa Cosmetics,Nykaa SKINgenius BB Cream SPF30,349,262,3.5,9718,
134,347361,Nykaa Cosmetics,Nykaa SKINgenius BB Cream SPF30 - Soft Beige 02,349,297,3.5,9718,
135,3446267,Nykaa Cosmetics,Nykaa Ultra Matte Mini- Marilyn - 10,239,239,4.1,27,
136,3446266,Nykaa Cosmetics,Nykaa Ultra Matte Mini- Cher 14,239,239,4.0,35,
137,3446264,Nykaa Cosmetics,Nykaa So Matte! Mini Lipstick - 17 M Cranberry Sangria,199,199,4.0,88,
138,3445858,Nykaa Cosmetics,Nykaa Cosmetics Breathable Nail Enamel Combo-Easy Nude + Dreamy Dahlia,398,318,4.0,1,
139,3445855,Nykaa Cosmetics,Nykaa Nail Enamel Combos- Barefoot Stroll + Purple Unicorn + Hasta La Pista Creme,537,483,4.1,248,
140,343888,Nykaa Cosmetics,Nykaa Mermaid Squad Pouch,450,450,4.0,276,
141,315084,Nykaa Cosmetics,Nykaa Bling It On! Mini Travel-Size Makeup Pouch - Stormy Goddess,199,169,3.7,8320,
142,315082,Nykaa Cosmetics,Nykaa Bling It On! Mini Travel-Size Makeup Pouch - Blushing Gold,199,169,3.7,8320,
143,286417,Nykaa Cosmetics,Nykaa Metal Addict Makeup Bag - Blushing Gold,300,300,4.0,10935,
144,277502,Nykaa Cosmetics,Nykaa All Thing Glam Makeup Bag - Pristine White,300,225,3.8,1028,
145,277501,Nykaa Cosmetics,Nykaa All Thing Glam Makeup Bag - Golden Hour,300,225,3.8,1028,
146,248367,Nykaa Cosmetics,Nykaa Party Edit Clutch,999,749,4.1,2600,
147,222623,Nykaa Cosmetics,Nykaa Bling It On Pouch,300,225,4.0,7423,
148,220091,Nykaa Cosmetics,Nykaa GLAMOReyes Coloured Liquid Eyeliner - 05 Dragon's Heart,299,239,3.9,11413,
149,209282,Nykaa Cosmetics,Nykaa SKINgenius Foundation Stick Conceal Contour & Corrector - Toffee Chisel 07,525,446,4.0,6524,
150,209281,Nykaa Cosmetics,Nykaa SKINgenius Foundation Stick Conceal Contour & Corrector - Golden Hazelnut 06,525,394,4.0,6524,
151,196392,Nykaa Cosmetics,Nykaa Get Winged! Sketch Eyeliner Pen - Black Swan 01,450,360,3.8,2141,
152,139821,Nykaa Cosmetics,Nykaa SKINgenius Skin Perfecting & Hydrating Matte Powder Compact - Rose Beige 02,525,446,4.1,4910,
153,139814,Nykaa Cosmetics,Nykaa SKINgenius Skin Perfecting & Hydrating Matte Powder Compact,525,368,4.1,4910,
154,127349,Nykaa Cosmetics,Nykaa Prove Your Point Cosmetic Sharpener! - 6112,175,149,4.0,109,
155,1181100,Nykaa Cosmetics,Nykaa Serial Kisser Lip Balm Combo - Strawberry & Raspberry,298,209,4.0,332,
156,1124808,Nykaa Cosmetics,Nykaa Paintstix! Waterproof Matte Lipstick - Polka Dots,499,374,4.1,11956,
157,1124796,Nykaa Cosmetics,Nykaa Paintstix! Waterproof Matte Lipstick - Flower Power,499,424,4.1,11956,
158,1066972,Nykaa Cosmetics,Nykaa Cosmetics Masaba By Nykaa Mini Pocket Perfume,299,224,4.1,4782,
159,8078,Nivea,"NIVEA Sun Lotion, SPF 50, with UVA & UVB Protection, Water Resistant Sunscreen",360,342,4.1,4431,
160,1473807,Nivea,Nivea Naturally Good Care Box,1198,1078,3.7,72,
161,822104,NYX Professional Makeup,NYX Professional Makeup Long Lasting Makeup Setting Spray Radiant Finish,875,875,4.1,263,
162,5525816,NYX Professional Makeup,NYX Professional Makeup Must Haves - Tinted Brow Mascara Espresso & Soft Matte Lip Cream Copenhagen,1349,699,3.7,1187,
163,42142,NYX Professional Makeup,NYX Professional Makeup Born To Glow Liquid Illuminator,850,723,4.1,2058,"FEATURED, BESTSELLER"
164,42114,NYX Professional Makeup,NYX Professional Makeup Wonder Stick,835,835,3.8,1131,
165,42085,NYX Professional Makeup,NYX Professional Makeup Pore Filler,1450,1450,4.1,446,
166,41880,NYX Professional Makeup,NYX Professional Makeup Liquid Suede Cream Lipstick,850,850,4.0,1191,
167,361744,NYX Professional Makeup,NYX Professional Makeup Powder Puff Lippie Cream,650,488,3.9,6672,BESTSELLER
168,190741,NYX Professional Makeup,NYX Professional Makeup Ultimate Multi-Finish Shadow Palette,1725,1725,4.1,95,
169,173656,NYX Professional Makeup,NYX Professional Makeup Suede Matte Lip Liner,450,450,4.0,572,
170,1134707,NYX Professional Makeup,NYX Professional Makeup Diamonds & Ice - Please Setting Spray Kit,1999,1999,3.7,12,
171,861356,Maybelline New York,Maybelline New York Define & Blend Brow Pencil,349,295,3.9,2666,
172,7749427,Maybelline New York,Maybelline New York Super Stay Matte Ink Liquid Lipstick Birthday Collection,699,559,4.1,30,NEW
173,73008,Maybelline New York,Maybelline New York V-Face Duo Stick,670,670,3.8,3130,
174,7066986,Maybelline New York,Maybelline New York Sensational Liquid Matte Minis Pack Of 3,297,285,3.8,49,
175,648691,Maybelline New York,Maybelline New York Tattoo Studio Gel Eyeliner Pencil,499,325,4.0,1464,
176,6057747,Maybelline New York,Maybelline New York Colossal Mascara With 2 Free Sensational Liquid Matte Mini - Best Babe,597,399,4.1,45,
177,48066,Maybelline New York,Maybelline New York The Blushed Nudes Eye Shadow Palette,999,749,4.1,10719,
178,4749403,Maybelline New York,Maybelline New York Fit Me Compact Powder,450,450,3.9,52,
179,452475,Maybelline New York,Maybelline New York Color Sensational Satin Lipstick,499,499,3.5,1039,
180,435129,Maybelline New York,Maybelline New York Shine Compulsion Lipstick,550,550,3.6,1667,
181,353883,Maybelline New York,Maybelline New York Lasting Drama Light Eyeliner Pencil,325,325,4.1,1034,
182,288288,Maybelline New York,Maybelline New York Color Sensational Matte Metallic Lipstick,475,475,4.0,1027,
183,26651,Maybelline New York,Maybelline New York Fashion Brow Duo Shaper,305,305,4.0,3925,
184,250,Maybelline New York,Maybelline New York Clear Smooth All in One UV+ Lightening Oil Control Two Way Cake SPF 32 PA+++,280,280,4.1,907,
185,189962,Maybelline New York,Maybelline New York Facestudio Master Strobing Cream,665,665,4.1,3106,
186,18423,Maybelline New York,Maybelline New York The Colossal Liner - Black,449,247,4.1,14332,
187,176376,Maybelline New York,Maybelline New York Face Studio Master Contour Palette,950,950,4.1,1074,
188,1287936,Maybelline New York,Maybelline New York Liner & Palette Combo: Blushed Look,1549,1549,4.1,13951,
189,1287915,Maybelline New York,Maybelline New York Bold & Nude - Eye Combo,1448,1448,4.1,11151,
190,995305,Lakme,Lakme Eye-conic Eyes Combo,750,630,3.9,9648,
191,981,Lakme,Lakme Kajal - Black,75,75,4.1,6197,
192,9471,Lakme,Lakme Absolute Forever Silk Eyeliner,395,395,3.4,270,
193,930436,Lakme,Lakme 9 To 5 Matte Moist Mattifying Moisturiser,349,279,4.1,763,
194,860860,Lakme,Lakme Absolute Illuminating Blush Shimmer Brick - In Pink + Eyeconic Curling Mascara - Black Combo,1175,976,4.1,1456,
195,68508,Lakme,Lakme Absolute Illuminating Blush Shimmer Brick,725,616,4.0,1309,
196,684657,Lakme,Lakme Absolute Kohl Ultimate The Gelato Collection,800,400,4.1,1654,
197,6565374,Lakme,Lakme Matte Ultimate Festive Lips Combo,1650,1650,4.1,35,
198,6028352,Lakme,Lakme 9to5 Primer + Matte Liquid Lip Color,499,499,4.0,739,
199,4639701,Lakme,Lakme Peach Milk Moisturizer Spf 24 Pa++,449,449,3.9,10,
200,4586552,Lakme,Lakme Perfect Definition Lipliner - Mauve Passion,260,260,3.3,13,
201,457014,Lakme,Lakme Blush & Glow Lemon Freshness Gel Face Wash,115,115,4.0,144,
202,44879,Lakme,Lakme Enrich Matte Lipstick,320,320,4.0,7829,
203,24093,Lakme,Lakme Enrich Satin Lipstick,260,260,4.1,2728,
204,189912,Lakme,Lakme Absolute Argan Oil Serum Foundation With SPF 45,825,660,4.1,2732,
205,1474924,Lakme,Lakme Absolute Plush Matte Lip Crayon,800,680,4.1,460,
206,14410,Lakme,Lakme Absolute Flutter Secrets Dramatic Eyes Mascara - Night Drama,775,659,4.0,214,
207,1290,Lakme,Lakme Absolute White Intense SPF 20 Concealer Stick,700,560,3.8,1200,
208,1268,Lakme,Lakme Face Sheer Blusher,450,383,4.1,3370,
209,1139,Lakme,Lakme True Wear Nail Color,125,125,4.1,11663,
210,1017,Lakme,Lakme Lip Gloss,200,200,4.0,1363,
211,771559,L'Oreal Paris,L'Oreal Paris Hair Colour Protection Combo - Casting Creme Gloss Hair Colour 400 Dark Brown + Magic Retouch,929,929,3.9,190,
212,7308001,L'Oreal Paris,L'Oreal Paris Glycolic Bright Day Regime,1297,1102,4.0,4,"FEATURED, NEW"
213,681194,L'Oreal Paris,L'Oreal Paris Infallible Ultra Matte Liquid Les Macarons Lipstick,799,799,4.1,714,
214,648660,L'Oreal Paris,L'Oreal Paris Le Bar Powder Blush - 8 City Explorer,849,509,4.1,56,
215,648655,L'Oreal Paris,L'Oreal Paris x Karl Lagerfeld Lipstick,750,750,4.1,87,
216,648648,L'Oreal Paris,L'Oreal Paris Matte Signature Eyeliner,650,650,4.0,526,
217,64110,L'Oreal Paris,L'Oreal Paris Volume Million Lashes Waterproof Mascara,999,999,4.1,413,
218,5612,L'Oreal Paris,L'Oreal Paris Superliner Black Lacquer,799,799,4.0,805,
219,479,L'Oreal Paris,L'Oreal Paris Infallible Le Rouge Lipstick,990,990,4.1,766,
220,4394259,L'Oreal Paris,L'Oreal Paris Casting Creme Gloss Ultra Visible Conditioning Hair Color,650,650,4.1,346,
221,435111,L'Oreal Paris,L'Oreal Paris Flash Cat Eye Eyeliner - Black,799,799,4.1,629,
222,36379,L'Oreal Paris,L'Oreal Paris Infallible Mega Gloss,830,830,4.1,167,
223,353931,L'Oreal Paris,L'Oreal Paris True Match BB Cream,670,670,4.1,587,
224,301196,L'Oreal Paris,L'Oreal Paris Casting Creme Gloss Hair Color - 316 + Magic Retouch Instant Root Concealer - 2 Dark Brown,929,929,3.7,150,
225,266374,L'Oreal Paris,L'Oreal Paris Excellence Fashion Highlights Hair Color,350,350,3.9,2501,
226,257862,L'Oreal Paris,L'Oreal Paris Infallible Gel Crayon Eyeliner,575,429,4.1,417,
227,18744,L'Oreal Paris,L'Oreal Paris Age 20+ Skin Perfect Cream UV Filters,115,115,4.1,2735,
228,160488,L'Oreal Paris,L'Oreal Paris Magic Retouch Instant Root Concealer Spray,299,299,4.1,8981,BESTSELLER
229,139993,L'Oreal Paris,L'Oreal Paris Infallible Pro-Spray & Set Makeup Extender,999,999,4.1,1746,
230,834303,Kay Beauty,Kay Beauty Illuminating Highlighter,799,639,4.1,3242,
231,766529,Kay Beauty,Kay Beauty HD Translucent Loose Powder - White,799,719,4.5,1497,
232,766520,Kay Beauty,Kay Beauty Matte HD Setting Loose Powder,799,599,4.5,4997,
233,692836,Kay Beauty,Kay Beauty Quick Dry Liquid Eyeliner,499,399,4.4,9552,
234,692818,Kay Beauty,Kay Beauty Ultra Black Volume & Length Mascara - Midnight,799,679,4.5,1760,
235,6599375,Kay Beauty,Kay Beauty Shine On Combo - Gel Eye Pencils In Bronze & Green,1198,1018,4.0,1,
236,6599374,Kay Beauty,Kay Beauty Cocktail Hour Combo - Gel Eye Pencils In Gold & Olive,1198,1018,3.0,4,
237,6599370,Kay Beauty,Kay Beauty Island Vibes Combo - Gel Eye Pencils In Blue & Green,1198,1018,4.0,1,
238,6583638,Kay Beauty,Kay Beauty Gel Eye Pencil,599,599,4.4,606,
239,654428,Kay Beauty,Kay Beauty Contour Stick,599,509,4.3,5927,
240,654419,Kay Beauty,Kay Beauty Colour Corrector Stick,599,449,3.9,2608,
241,626907,Kay Beauty,Kay Beauty Nail Nourish Nail Enamel Polish,225,169,4.3,22495,BESTSELLER
242,598027,Kay Beauty,Kay Beauty Metallic Eyeshadow Stick Pencil,599,449,4.5,7879,
243,573594,Kay Beauty,Kay Beauty Waterproof 24 Hour Kajal - Spade - Black,249,249,4.5,14815,BESTSELLER
244,573572,Kay Beauty,Kay Beauty Matte Action Lip Liner,550,413,4.5,5372,
245,573181,Kay Beauty,Kay Beauty Matteinee Matte Lip Crayon Lipstick,799,639,4.3,15040,BESTSELLER
246,5722072,Kay Beauty,Kay Beauty HD Liquid Colour Corrector,799,679,4.4,565,
