,product_id,brand_name,product_title,mrp,price,product_rating,product_rating_count,product_tags
247,5093150,Kay Beauty,Kay Beauty Creme Blush,799,799,4.5,2010,"FEATURED, BESTSELLER"
248,4970783,Kay Beauty,Kay Beauty Lip & Cheek Combo,1598,1358,4.8,6,
249,4970778,Kay Beauty,Kay Beauty Glittery Glam Nails Look With Kay Beauty Nail Enamel Nail Polish,474,356,4.7,9,
250,4518371,Kay Beauty,Kay Beauty Hd Liquid Concealer,799,679,4.4,1237,"FEATURED, BESTSELLER"
251,3772408,Kay Beauty,Kat's Bold Night Look - Kay Beauty Matte Lipstick & Liquid Eyeliner,1498,1273,4.0,6,
252,3621135,Kay Beauty,Kay Beauty Matte Lips Combo - Lip Crayon - Wee Hours & Matte Lipstick - Backstage,1798,1438,4.0,6,
253,3621132,Kay Beauty,Get Party Ready With Kay Beauty Lip Liner - Dance Off & Matte Lipstick - Premier,1549,1394,4.0,1,
254,2809497,Kay Beauty,Kay Beauty Pastel Perfection Nail Enamel Combo,450,360,2.7,7,
255,2809496,Kay Beauty,Kay Beauty Nail Nourish Nail Emanel Combo - Carnival & Wine Berry,450,360,4.0,1,
256,2809493,Kay Beauty,Kay Beauty Paint Your Mood Nail Enamel Combo,675,506,3.8,4,
257,2809492,Kay Beauty,Kay Beauty Pastel Crush Nail Enamel Combo- Tender Lavender + Aspire + Pink Gem,675,574,3.9,40,
258,2783917,Kay Beauty,The Ultimate Nude Duo - Kay Beauty Long Stay Matte Lipstick - Debut & Nail Enamel - Nutty 21,1224,1102,4.0,2,
259,2783911,Kay Beauty,Kay Beauty Matteinee Matte Lip Crayon Lipstick Combo - Rom Com & Wee Hours,1598,1438,4.1,15,
260,2662674,Kay Beauty,Kay Beauty Colour Correcting Primer,799,599,4.0,952,FEATURED
261,1324436,Kay Beauty,Kay Beauty Eyeshadow Palette,1199,959,4.6,2181,FEATURED
262,1229442,Kay Beauty,Kay Beauty Hydrating Foundation,1200,900,4.4,4577,"FEATURED, BESTSELLER"
263,1129386,Kay Beauty,Kay Beauty Matte Compact,799,639,4.4,2857,"FEATURED, BESTSELLER"
264,1080669,Kay Beauty,Kay Beauty Matte Blush,799,639,4.5,4619,
265,1010793,Kay Beauty,Kay Beauty Matte Drama Long Stay Lipstick,999,749,4.4,3696,"FEATURED, BESTSELLER"
266,6604347,Herbal Essences,Herbal Essences Strawberry Shampoo + Strawberry Conditioner,980,667,4.1,1985,
267,6604346,Herbal Essences,Herbal Essences Argan Shampoo + Argan Conditioner,980,667,4.2,6170,
268,594425,Herbal Essences,Herbal Essences Argan Oil Of Moroccan Shampoo & Conditioner With Free Neem Comb,1250,750,4.3,11761,
269,5360840,Herbal Essences,Herbal Essences Strawberry & Mint Conditioner - For Cleansing & Volume - Paraben Free,380,277,4.3,1093,
270,5360839,Herbal Essences,Herbal Essences Argan Oil Of Morocco Conditioner - For Frizz Free Hair - Paraben Free,650,390,4.4,5130,"FEATURED, BESTSELLER"
271,5360838,Herbal Essences,Herbal Essences Strawberry & Mint Shampoo - For Cleansing & Volume - Paraben Free,600,390,4.1,2502,BESTSELLER
272,5360837,Herbal Essences,Herbal Essences Argan Oil Of Morocco Shampoo - For Frizz Free Hair - Paraben Free,600,390,4.3,8769,"FEATURED, BESTSELLER"
273,4719645,Herbal Essences,"Herbal Essences Strawberry Shampoo & Conditioner For Voluminous Hair - No Parabens, No Colourants",730,533,4.7,304,"FEATURED, BESTSELLER"
274,4719644,Herbal Essences,"Herbal Essences Argan Oil Shampoo & Conditioner For Frizz - No Parabens, No Colourants",730,533,4.7,305,"FEATURED, BESTSELLER"
275,456563,Herbal Essences,"Herbal Essences Strawberry Shampoo & Conditioner For Volume - No Parabens, No Colourants",1250,875,4.1,3009,
276,456562,Herbal Essences,"Herbal Essences Cocoa Butter Shampoo & Conditioner For Hair Strengthening - No Parabens, No Colourants",1250,875,4.3,2165,
277,456560,Herbal Essences,"Herbal Essences Coconut Milk Shampoo & Conditioner For Hydration & Softness - No Parabens, No Colourants",1250,875,4.3,3665,
278,456559,Herbal Essences,"Herbal Essences Argan Oil Shampoo & Conditioner For Frizz - No Parabens, No Colourants",1250,688,4.3,10879,"FEATURED, BESTSELLER"
279,452449,Herbal Essences,Herbal Essences Bio:Renew Strength Whipped Cocoa Butter Conditioner,650,423,4.4,711,
280,452448,Herbal Essences,Herbal Essences Bio:Renew Hydrate Coconut Milk Conditioner,650,423,4.4,1117,
281,452443,Herbal Essences,"Herbal Essences Cocoa Butter Shampoo For Hair Strengthening - No Parabens, No Colourants",600,390,4.3,1206,
282,452442,Herbal Essences,Herbal Essences Coconut Milk Shampoo For Hydration & Softness - No Parabens- No Colourants,600,390,4.2,2077,BESTSELLER
283,3753166,Herbal Essences,"Herbal Essences Aloe & Bamboo Shampoo + Conditioner Kit For Soft Hair, Sulphate & Paraben Free",1575,945,4.3,65,FEATURED
284,2659739,Herbal Essences,Herbal Essences Argan Oil Of Moroccan Shampoo & Conditioner With Free Neem Comb,1250,750,4.4,1008,"FEATURED, BESTSELLER"
285,1290147,Herbal Essences,"Herbal Essences Aloe & Eucalyptus Shampoo + Aloe & Bamboo Conditioner, No- Sulphates & Paraben",1575,1103,4.4,1036,
286,1290145,Herbal Essences,"Herbal Essences Aloe & Bamboo Shampoo + Conditioner For Soft Smooth Hair, No Sulphates & Paraben",1575,1181,4.4,1034,FEATURED
287,1135937,Herbal Essences,Herbal Essences Cocoa Butter 2 Shampoo + Conditioner,1850,1295,4.4,1933,
288,1135936,Herbal Essences,Herbal Essences Coconut 2 Shampoo + Conditioner,1850,1295,4.3,3213,
289,1135935,Herbal Essences,Herbal Essences Strawberry 2 Shampoo + Conditioner,1850,1295,4.1,2669,
290,1135934,Herbal Essences,Herbal Essences Argan 2 Shampoo + Conditioner,1850,1295,4.3,9506,
291,1044492,Herbal Essences,"Herbal Essences Aloe & Bamboo Shampoo For Soft Smooth Hair, No-Sulphates, Paraben and Silicones",750,525,4.3,503,FEATURED
292,1044491,Herbal Essences,Herbal Essences Aloe & Bamboo Conditioner Soft Smooth Hair- No- Sulphates and Paraben(400gm),825,578,4.4,467,
293,1044490,Herbal Essences,"Herbal Essences Aloe & Eucalyptus Shampoo For Soft Smooth Hair, No- Sulphates, Paraben and Silicones",750,525,4.3,512,FEATURED
294,4633369,Colorbar,Colorbar Mogra Mist - Scent Of An India Temple - 001,595,417,1.5,2,
